{
  "meta": {
    "title": "中西并置（原创样张）",
    "genre": "论说",
    "lang": "zh-Hans+latin",
    "source": "原创，非原书文本"
  },
  "page": {
    "w_mm": 148,
    "h_mm": 210
  },
  "dpi": 240,
  "canon": {
    "type": "van_de_graaf",
    "page_side": "recto"
  },
  "base_text": {
    "size_Q": 13,
    "leading_ratio": 1.8,
    "cjk_weight": "Regular",
    "latin_scale": 1.04
  },
  "heading": {
    "text": "中西并置 · idea",
    "size_pt": 16,
    "align": "center",
    "lines_below": 2
  },
  "body": [
    "在中文与西文同处一页时，最要紧的是让两种文字气息相当。西文若取 Garamond、Sabon 或 Dante 一类有清楚来历的旧体，与中文明朝体并置，便须让它们的字面大小、重心与浓淡彼此呼应，西文不至于显得小一号或浮一截。一个简单可行的办法，是把拉丁字母的 cap-height 调到约合中文字身的七成，再回看整行的灰度是否与中文一致；若西文偏淡，就略微加粗或放大一档，直到两者在一片灰里看不出谁轻谁重为止。",
    "设定之前，不妨先问一句：这段 Typographic Composition 想要的是安静，还是热闹？答案从来不在某一款字本身，而藏在它与字号、行距、栏宽、油墨、纸张以及读者经验之间的关系里。把这层关系一一理顺，让 the grid 退到背后只当骨架，让每一个西文词与相邻的汉字呼吸一致，一页中西混排才谈得上真正的统一，而不是两种文字勉强挤在一起。",
    "也要记得，西文与中文各有自己的节奏：拉丁词靠词距断开，汉字则字字等宽地排过去。两套节奏相遇时，标点与数字的处理最见功夫——让 2014 这样的数字、idea 这样的小词，既不挤进汉字的方格，也不撑开行的呼吸，是中西混排里最细也最值得反复推敲的一处。"
  ],
  "first_line_indent_chars": 2,
  "folio": 5,
  "ink_rgb": [
    22,
    20,
    17
  ]
}