{
  "page": {
    "w_mm": 148,
    "h_mm": 210
  },
  "dpi": 240,
  "canon": {
    "type": "van_de_graaf",
    "page_side": "recto"
  },
  "base_text": {
    "size_Q": 13,
    "leading_ratio": 1.8,
    "cjk_weight": "Regular"
  },
  "heading": {
    "text": "论一页的安稳",
    "size_pt": 16,
    "align": "center",
    "lines_below": 2
  },
  "body": [
    "一页排得好不好，往往不在某个字有多漂亮，而在整片文字读起来是否安稳。读者的眼睛沿着行一路向前，遇到合宜的字距与行距，便不知不觉地读了下去；遇到忽松忽紧的地方，脚步就会被悄悄绊一下。好的版面把这些绊脚之处一一抹平，让人忘了版面的存在，只记得读到的内容。所以排版者真正经营的，是黑与白两件事：着墨的笔画，与不着墨的空隙。字内有腔，字间有距，行间有隙，栏外有边，这些空白并非多余的剩料，而是与笔画同等重要的另一半；把黑与白放在同一片秩序里反复掂量，使整页的浓淡均匀、疏密得当，文字才会显出一种不抢眼却耐看的气质。",
    "要判断这片浓淡是否匀净，不妨眯起眼睛远远地看：清晰的字形会化成一片灰，灰得均匀，说明各处的空间关系都对了；某处发黑或发白，就是那里的间距出了问题。这种看灰度的眼光，是可以靠日积月累练出来的，但前提是每一处设定都说得出道理，而不是凭一时的手感去碰运气。说到底，版面的气质是从克制里长出来的，不是从装饰里堆出来的：能少放一笔就少放一笔，能不强调就不强调，把多余的花样去掉，留下的秩序自会替你说话。一页安稳耐读的文字，往往胜过十处用力的巧思。"
  ],
  "first_line_indent_chars": 2,
  "para_gap_lines": 0,
  "folio": 3,
  "ink_rgb": [
    22,
    20,
    17
  ],
  "meta": {
    "title": "论一页的安稳（原创样张）",
    "genre": "随笔/论说",
    "lang": "zh-Hans",
    "source": "原创，非原书文本"
  }
}